{
  "metadata": {
    "editionDate": "2026-08-23",
    "updatedAt": "2026-08-23T07:35:40+03:00",
    "timezone": "Europe/Bucharest",
    "title": "Resturile explozive de la Tuzla, semnalele din NATO și șocul comercial SUA-Canada ridică nivelul de prudență",
    "status": "draft",
    "primarySource": "https://www.biziday.ro/feed/",
    "sourceCoverage": "complete"
  },
  "executiveSummary": [
    {
      "id": "resturile-explozive-de-la-tuzla-prelungesc-vigilenta-la-marea-neagra",
      "text": "Detonarea controlată a fragmentelor de dronă de la Tuzla arată că riscul de securitate de la Marea Neagră rămâne unul operațional, chiar și fără un atac confirmat asupra unei ținte populate.",
      "category": "Securitate"
    },
    {
      "id": "flancul-estic-vrea-sa-plateasca-mai-mult-pentru-garantia-americana",
      "text": "Discuția despre acoperirea unei părți mai mari din costurile bazelor SUA arată că aliații estici tratează deja drept real riscul unei revizuiri americane mai dure a prezenței militare în regiune.",
      "category": "Securitate"
    },
    {
      "id": "romania-exporta-capacitate-de-interventie-in-serbia-nu-doar-alarme",
      "text": "Trimiterea echipajelor și a elicopterului Black Hawk în Serbia mută România din registrul reacției defensive în cel al furnizării efective de capacitate regională de intervenție.",
      "category": "Extern"
    },
    {
      "id": "bruiajul-gps-din-sofia-arata-cat-de-usor-intra-riscul-tehnic-in-aviatie",
      "text": "Dispozitivul de bruiaj GPS descoperit la Sofia confirmă că vulnerabilitățile tehnologice pot apărea rapid în infrastructură critică, chiar dacă zborurile nu au fost perturbate oficial.",
      "category": "Securitate"
    },
    {
      "id": "conflictul-comercial-sua-canada-reaprinde-riscul-pentru-lanturile-industriale",
      "text": "Tarifele americane de 50% pe bunuri canadiene și promisiunea unei replici dolar pentru dolar readuc volatilitatea comercială nord-americană în prețurile și așteptările globale.",
      "category": "Piețe"
    },
    {
      "id": "atacul-de-la-krivoi-rog-mentine-prima-regionala-de-risc-ridicata",
      "text": "Lovitura rusă de tip dublu asupra unui centru comercial din Krivoi Rog arată că războiul rămâne capabil să producă șocuri umane severe și să mențină ridicat premiumul regional de risc.",
      "category": "Extern"
    }
  ],
  "importantNews": [
    {
      "id": "fragmentele-de-la-tuzla-confirma-ca-riscul-maritim-ramane-activ",
      "title": "Fragmentele de la Tuzla confirmă că riscul maritim rămâne activ pe litoral",
      "fact": "Biziday a relatat pe 22 august 2026 că scafandrii militari au intervenit în zona plajei Tuzla după semnalarea unor fragmente de dronă, iar HotNews și Digi24 au consemnat ulterior că MApN a confirmat prezența unei încărcături explozive, neutralizată prin detonare controlată, fragmentele provenind dintr-o dronă de fabricație ucraineană.",
      "interpretation": "Faptul confirmat este existența unor resturi explozive pe litoralul românesc, nu producerea unui atac direct asupra unei zone locuite. Scenariul mai probabil este prelungirea regimului de verificare și reacție rapidă la Marea Neagră, cu sensibilitate crescută în jurul infrastructurii și plajelor.",
      "category": "Securitate",
      "impact": 4,
      "impactLabel": "Semnificativ",
      "horizon": "Imediat",
      "sourceId": "biziday-tuzla-drona-2026-08-22",
      "sourceName": "Biziday",
      "sourceUrl": "https://www.biziday.ro/366765-2/",
      "isSecondary": true,
      "confidence": "confirmed"
    },
    {
      "id": "aliatii-estici-incearca-sa-fixeze-mai-strans-prezenta-americana",
      "title": "Aliații estici încearcă să fixeze mai strâns prezența americană în regiune",
      "fact": "Biziday a relatat pe 22 august 2026, citând Bloomberg, că statele NATO din estul Europei vor să acopere o parte din costurile bazelor SUA, iar Digi24 a consemnat că propunerea este pregătită pentru reuniunea din 27 august de la Bruxelles cu Elbridge Colby, pe fondul revizuirii de șase luni a prezenței militare americane în Europa.",
      "interpretation": "Faptul confirmat este că există o ofertă de cost-sharing discutată politic, nu o decizie finală privind retragerea unor trupe americane din flancul estic. Scenariul mai probabil este unul în care aliații încearcă să cumpere timp și predictibilitate strategică înainte ca revizuirea Pentagonului să producă mutări concrete.",
      "category": "Securitate",
      "impact": 4,
      "impactLabel": "Semnificativ",
      "horizon": "1–3 luni",
      "sourceId": "biziday-nato-costuri-baze-2026-08-22",
      "sourceName": "Biziday",
      "sourceUrl": "https://www.biziday.ro/366798-2/",
      "isSecondary": true,
      "confidence": "confirmed"
    },
    {
      "id": "romania-trece-de-la-alerta-la-sprijin-regional-activ",
      "title": "România trece de la alertă internă la sprijin regional activ în Serbia",
      "fact": "Biziday a relatat pe 22 august 2026 că România trimite în Serbia elicopterul Black Hawk pentru stingerea incendiilor din Deliblato Sands, iar Digi24 a consemnat că 69 de pompieri români și 15 mijloace tehnice au plecat spre țara vecină, în contextul unor incendii care au afectat peste 3.500 de hectare.",
      "interpretation": "Faptul confirmat este mobilizarea unui sprijin românesc concret prin mecanism european, nu o simplă declarație de disponibilitate. Scenariul mai probabil este consolidarea profilului regional al României în intervenții de urgență, simultan cu accentuarea presiunii climatice și logistice în vecinătate.",
      "category": "Extern",
      "impact": 3,
      "impactLabel": "Relevant",
      "horizon": "Imediat",
      "sourceId": "biziday-serbia-black-hawk-2026-08-22",
      "sourceName": "Biziday",
      "sourceUrl": "https://www.biziday.ro/366762-2/",
      "isSecondary": true,
      "confidence": "confirmed"
    },
    {
      "id": "bruiajul-gps-din-sofia-devine-un-semnal-pentru-infrastructura-critica",
      "title": "Bruiajul GPS din Sofia devine un semnal pentru infrastructura critică regională",
      "fact": "Biziday a relatat pe 22 august 2026 că Bulgaria a neutralizat un dispozitiv puternic de bruiaj GPS descoperit la periferia Sofiei, iar Digi24 a consemnat că dispozitivul afecta frecvențele GPS din Sofia, inclusiv în zona aeroportului, în timp ce aeroportul a precizat că zborurile s-au desfășurat conform orarului.",
      "interpretation": "Faptul confirmat este existența unui dispozitiv de interferență cu acoperire largă, nu producerea unui incident aviatic major. Scenariul mai probabil este creșterea atenției pentru vulnerabilitățile tehnice ale aviației și ale infrastructurii critice în Europa de Est.",
      "category": "Securitate",
      "impact": 3,
      "impactLabel": "Relevant",
      "horizon": "1–4 săptămâni",
      "sourceId": "biziday-gps-sofia-2026-08-22",
      "sourceName": "Biziday",
      "sourceUrl": "https://www.biziday.ro/366825-2/",
      "isSecondary": true,
      "confidence": "confirmed"
    },
    {
      "id": "escaladarea-sua-canada-aduce-inapoi-frictiunea-comerciala-nord-americana",
      "title": "Escaladarea SUA-Canada aduce înapoi fricțiunea comercială nord-americană",
      "fact": "Biziday a relatat pe 22 august 2026 că negocierile comerciale dintre SUA și Canada au fost suspendate și că Washingtonul a impus tarife de 50% pentru mărfuri canadiene în valoare de 20 de miliarde de dolari, iar Financial Times a consemnat pe 23 august 2026 că Mark Carney a spus că țara sa este „în război” comercial cu SUA și că Ottawa va egala noile tarife americane.",
      "interpretation": "Faptul confirmat este o escaladare tarifară bilaterală, nu o ruptură finală și ireversibilă a arhitecturii comerciale nord-americane. Scenariul mai probabil este o perioadă de volatilitate și renegociere dură, cu efect asupra sentimentului industrial, logisticii și apetitului pentru risc.",
      "category": "Piețe",
      "impact": 4,
      "impactLabel": "Semnificativ",
      "horizon": "Imediat",
      "sourceId": "biziday-canada-sua-tarife-2026-08-22",
      "sourceName": "Biziday",
      "sourceUrl": "https://www.biziday.ro/366753-2/",
      "isSecondary": true,
      "confidence": "confirmed"
    },
    {
      "id": "krivoi-rog-reaminteste-ca-razboiul-poate-lovi-civil-direct-si-repetat",
      "title": "Krivoi Rog reamintește că războiul poate lovi civil direct și repetat",
      "fact": "Biziday a relatat pe 22 august 2026 că drone rusești au atacat de două ori la rând un centru comercial din Krivoi Rog, iar Financial Times a consemnat pe 23 august 2026 că un atac rusesc de tip „double-tap” asupra unui centru comercial ucrainean a ucis cel puțin 16 persoane, în timp ce Volodimir Zelenski a cerut presiune reală asupra Moscovei.",
      "interpretation": "Faptul confirmat este un atac grav asupra unei ținte civile, nu o schimbare decisivă a raportului militar din teren. Scenariul mai probabil este menținerea unei prime regionale de risc ridicate și a unei sensibilități sporite pentru orice extindere a efectelor umanitare și logistice ale războiului.",
      "category": "Extern",
      "impact": 4,
      "impactLabel": "Semnificativ",
      "horizon": "Imediat",
      "sourceId": "biziday-krivoi-rog-2026-08-22",
      "sourceName": "Biziday",
      "sourceUrl": "https://www.biziday.ro/366722-2/",
      "isSecondary": true,
      "confidence": "confirmed"
    }
  ],
  "romaniaAnalysis": {
    "factBase": [
      "Biziday, HotNews și Digi24 au relatat pe 22 august 2026 că fragmentele de dronă găsite la Tuzla aveau încărcătură explozivă, neutralizată controlat, iar primele verificări au indicat o dronă de fabricație ucraineană.",
      "Biziday și Digi24 au relatat pe 22 august 2026 că România a trimis în Serbia 69 de pompieri, 15 mijloace tehnice și un elicopter Black Hawk pentru incendiile din Deliblato Sands, unde au fost afectate peste 3.500 de hectare.",